{
  "$schema": "http://json-schema.org/draft-07/schema#",
  "title": "PDA MATE-NEM (v5)",
  "description": "Estructura modular de un Proceso de Desarrollo de Aprendizaje (PDA) de Matemáticas, NEM. Flujo: problematización (gancho de contexto real) → de 1 a 12 subtemas de menor a mayor dificultad, cada uno con su propia mini-actividad calificada de 5-10 reactivos (mini-resultado independiente con puntos y estrellas) → resultado global del PDA (suma de los mini-resultados). Desde el Paso 27, un PDA curricular por grado vive dividido en 10 'series' de 1 sola lección cada una (archivos independientes, mismo Contenido/PDA NEM oficial, mismo `eje`/`trimestre`, id con sufijo -01.._-10, título con sufijo '<N>.1'…'<N>.10'): cada serie trae exactamente 1 subtema (la lección completa, sin recortar), con su propia problematización, su propio resultado y su propia constancia independiente al terminarla. El `nivelEtiqueta` de cada lección se conserva TAL CUAL venía del Paso 25 ('Nivel N de 10 · <etiqueta>') en vez de recalcularse sobre el total de 1 — así conserva su contexto real de dificultad dentro del tema completo. `practicaExtra` se reparte en 10 partes proporcionales, una por lección. (El Paso 26, que agrupaba las lecciones en 3 series de 3-4, quedó superado por este diseño de 1 lección = 1 serie.) Una 'tarjeta dividida' de camino (Paso 15, en desuso desde el Paso 21) también trae exactamente 1 subtema.",
  "type": "object",
  "required": ["id", "grado", "campoFormativo", "eje", "titulo", "problematizacion", "subtemas"],
  "properties": {
    "id": {
      "type": "string",
      "description": "Identificador único, convención: '<grado>S-B<bloque>-PDA<num>', ej. '2S-B1-PDA03'"
    },
    "grado": {
      "type": "string",
      "enum": ["1°", "2°", "3°", "Ejercítate", "Operaciones Básicas", "Acarreos y Llevadas"],
      "description": "'Ejercítate', 'Operaciones Básicas' y 'Acarreos y Llevadas' son pseudo-grados de práctica libre: no pertenecen a la ruta curricular de ningún grado en particular. 'Ejercítate' vive en data/ejercitate/ (40 temas, cada uno con 4 subtemas en un solo archivo). 'Operaciones Básicas' (Paso 28, reestructurado en el Paso 29) vive en data/operaciones-basicas/: 44 temas de suma/resta, multiplicación/división y potencias/raíces, cada uno dividido en 4 'módulos' — archivos independientes de 1 solo subtema con 10 reactivos (dos rondas de 5, Paso 16), mismo diseño que las series de grado desde el Paso 27 (su propio resultado y su propia constancia por módulo). 'Acarreos y Llevadas' (Paso 29) vive en data/acarreos-llevadas/: ~50 temas, uno por operación (suma/resta/multiplicación/división/potencias/raíces), SOLO con reactivos tipo 'algoritmo_columnas' ('completa las casillas'), cada uno con 1 solo módulo de 10 reactivos (dos rondas de 5). Los tres pseudo-grados requieren además el campo 'categoria'."
    },
    "trimestre": { "type": "string", "enum": ["1", "2", "3"] },
    "numero": {
      "type": "integer",
      "description": "Número de tema/serie dentro de su (pseudo-)grado (1, 2, 3…), en el orden en que se recorren en el camino. Se muestra en la interfaz como 'Tema N'. Para 'Ejercítate' llega hasta 40; para 'Operaciones Básicas' llega hasta 176 (44 temas × 4 módulos, desde el Paso 29); para 'Acarreos y Llevadas' llega hasta ~50 (Paso 29)."
    },
    "categoria": {
      "type": "string",
      "enum": ["basico", "intermedio", "avanzado", "estadistica", "suma_resta", "mult_div", "potencias_raices", "integracion", "acarreo_suma", "acarreo_resta", "acarreo_mult", "acarreo_div", "acarreo_potencias", "acarreo_raices"],
      "description": "Agrupa el tema en uno de los caminos de su pseudo-grado. Para grado='Ejercítate': básico/intermedio/avanzado/estadística (4 caminos). Para grado='Operaciones Básicas' (Paso 28): suma_resta/mult_div/potencias_raices/integracion (4 bloques, 12+16+12+4 = 44 temas). Para grado='Acarreos y Llevadas' (Paso 29): acarreo_suma/acarreo_resta/acarreo_mult/acarreo_div/acarreo_potencias/acarreo_raices (6 caminos, uno por operación, de menor a mayor dificultad dentro de cada uno)."
    },
    "campoFormativo": { "type": "string", "const": "Saberes y Pensamiento Científico" },
    "eje": { "type": "string" },
    "titulo": { "type": "string" },
    "contenido": { "type": "string", "description": "Enunciado oficial del Contenido de la NEM" },
    "pda": { "type": "string", "description": "Enunciado oficial del Proceso de Desarrollo de Aprendizaje" },

    "problematizacion": {
      "type": "object",
      "description": "Fase 1: gancho de contexto real que despierta interés, antes de explicar el tema.",
      "required": ["contexto", "pregunta"],
      "properties": {
        "contexto": { "type": "string" },
        "pregunta": { "type": "string" }
      }
    },

    "subtemas": {
      "type": "array",
      "description": "El tema explicado y evaluado en partes, de menor a mayor dificultad. Cada subtema es una mini-actividad autocontenida: teoría (titulo/explicacion/ejemplos) + su propia mini-actividad calificada de 5-10 reactivos, con resultado (puntos, estrellas) independiente de los demás. Al completar todos, el PDA muestra un resultado global (suma de todos los mini-resultados). Desde el Paso 27, un PDA curricular por grado vive dividido en 10 series de 1 sola lección cada una (ver descripción raíz del esquema): cada serie trae exactamente ESTE subtema, sin tocar su contenido (teoría/reactivos) heredado tal cual del Paso 25, y su `nivelEtiqueta` se conserva fijo sobre la escala ORIGINAL de 10 lecciones del tema completo (p.ej. 'Nivel 7 de 10 · Reto'), no se recalcula sobre 1. Ejercítate (pseudo-grado) sigue con 4 subtemas en un solo archivo, sin cambios. Desde el Paso 15, un PDA también puede tener un SOLO subtema (minItems 1, en desuso desde el Paso 21 salvo por el propio diseño de series de 1 lección del Paso 27): es una 'tarjeta dividida' del camino. En ese caso el subtema trae su propio campo 'nivelEtiqueta' (ver abajo) porque su posición real no puede deducirse de su índice dentro de un arreglo de un solo elemento.",
      "minItems": 1,
      "maxItems": 12,
      "items": {
        "type": "object",
        "required": ["titulo", "explicacion", "ejemplos", "puntosPorReactivo", "estrellasMax", "reactivos"],
        "properties": {
          "numero": {
            "type": "string",
            "description": "Número jerárquico del subtema, formato '<numero del PDA>.<consecutivo>' (ej. '3.2' = subtema 2 del tema 3, '3.4' = el más difícil/de síntesis de ese tema). Si el PDA tiene subtemas de repaso opcionales, continúan la numeración a partir de .5 (ej. '3.5', '3.6', '3.7'). Se muestra en la interfaz junto al título del subtema."
          },
          "nivelEtiqueta": {
            "type": "string",
            "description": "Etiqueta fija de nivel/dificultad a mostrar en vez de calcularla por índice (ver nivelChip_ en app.js) — necesaria en cualquier PDA de un solo subtema (Paso 15: 'tarjeta dividida'; Paso 27: series de grado; Paso 28/29: módulos de 'Operaciones Básicas' y 'Acarreos/Llevadas'), donde el índice dentro del arreglo (siempre 0) no revela la posición real del subtema en su tema de origen. Formato idéntico al que generaría el motor, ej. 'Nivel 3 de 4 · Avanzado' o 'Repaso 2 de 3'. Los módulos de 'Operaciones Básicas' usan la escala fija de 4 niveles del Paso 29: 'Nivel N de 4 · <etiqueta>' con etiquetas Introductorio/Intermedio/Avanzado/Integración (cada módulo trae 10 reactivos, dos rondas de 5)."
          },
          "titulo": { "type": "string" },
          "explicacion": { "type": "string", "description": "Explicación del subtema, más desarrollada que una síntesis breve. El subtema 4 ('Síntesis y aplicación') recapitula las ideas clave de los subtemas 1-3." },
          "formula": { "type": "string" },
          "ejemplos": {
            "type": "array",
            "minItems": 1,
            "items": { "type": "string" },
            "description": "Uno o más ejemplos resueltos que ilustran el subtema."
          },
          "puntosPorReactivo": { "type": "integer", "description": "Puntos otorgados por cada reactivo correcto de ESTE subtema (mini-actividad independiente)." },
          "estrellasMax": { "type": "integer", "default": 3, "description": "Estrellas máximas de ESTE subtema (mini-actividad independiente)." },
          "ejemploResuelto": {
            "type": "object",
            "description": "OPCIONAL (Paso 34). Un problema representativo de este subtema, YA resuelto paso a paso, mostrado como un paso intermedio entre la teoría (explicacion/ejemplos) y la actividad calificada (reactivos) — reduce la carga cognitiva porque el alumno ve el procedimiento COMPLETO antes de tener que aplicarlo solo en los reactivos. Si el subtema no trae este campo, el paso simplemente no aparece (compatible hacia atrás, sin cambiar nada del comportamiento existente).",
            "required": ["enunciado", "pasos"],
            "properties": {
              "enunciado": { "type": "string", "description": "El problema a resolver, en el mismo tono situacional de la NEM que la problematización — puede ser el mismo tipo de situación que luego aparece en los reactivos, o uno nuevo representativo." },
              "pasos": {
                "type": "array",
                "minItems": 2,
                "maxItems": 6,
                "description": "El procedimiento explicado paso a paso, en el orden en que se resuelve.",
                "items": {
                  "type": "object",
                  "required": ["texto"],
                  "properties": {
                    "texto": { "type": "string", "description": "Qué se hace en este paso y por qué (una o dos oraciones)." },
                    "operacion": { "type": "string", "description": "Opcional: el cálculo de este paso, mostrado en fuente monoespaciada aparte del texto (ej. '18 ÷ 2 = 9')." }
                  }
                }
              },
              "respuestaFinal": { "type": "string", "description": "Opcional: la respuesta final del ejemplo, resaltada al cierre del procedimiento." }
            }
          },
          "reactivos": {
            "type": "array",
            "minItems": 5,
            "maxItems": 10,
            "items": { "$ref": "#/definitions/pregunta" },
            "description": "Los reactivos calificados de este subtema, en múltiplos de 5: exactamente 5 = una sola ronda (paso 'actividad' único); exactamente 10 = dos rondas de 5 (Paso 16: la app las presenta como dos pantallas de actividad consecutivas — 'paso 3' y 'paso 4' del recorrido — antes de calificar juntas las 10 en un solo mini-resultado). El motor (`vistaPDA` en app.js) deriva el número de rondas de `Math.ceil(reactivos.length / 5)`, así que un mismo PDA puede tener subtemas de 5 (una ronda) sin cambios de comportamiento."
          }
        }
      }
    },

    "practicaExtra": {
      "type": "array",
      "description": "Fase opcional, no calificada: reactivos adicionales mostrados después del resultado global del PDA, para quien quiera seguir practicando el mismo tema. No afectan el puntaje ni las estrellas.",
      "items": { "$ref": "#/definitions/pregunta" }
    }
  },

  "definitions": {
    "pregunta": {
      "type": "object",
      "description": "Una pregunta de cualquiera de los 5 tipos soportados. Los campos requeridos varían según 'tipo'.",
      "required": ["tipo", "retroalimentacion"],
      "properties": {
        "tipo": {
          "type": "string",
          "enum": ["opcion_multiple", "verdadero_falso", "llenar_frase", "relacionar_columnas", "algoritmo_columnas"]
        },
        "retroalimentacion": { "type": "string", "description": "Explicación mostrada después de responder, sea correcta o incorrecta." },
        "pistas": {
          "type": "array",
          "minItems": 1,
          "maxItems": 3,
          "items": { "type": "string" },
          "description": "OPCIONAL (Paso 34). Pistas progresivas, de la más general a la más específica (normalmente: 1) una pista conceptual, 2) un paso del procedimiento, 3) casi la respuesta). El alumno las pide una por una con un botón 'Necesito una pista' durante la actividad calificada, sin que esto afecte su calificación. Si el reactivo no trae este campo, no se muestra ningún botón de pista (compatible hacia atrás)."
        },

        "pregunta": { "type": "string", "description": "[opcion_multiple] El enunciado de la pregunta." },
        "opciones": { "type": "array", "items": { "type": "string" }, "description": "[opcion_multiple] Lista de opciones." },
        "respuestaCorrecta": {
          "description": "[opcion_multiple] índice (entero, base 0) de la opción correcta. [verdadero_falso] booleano. [llenar_frase] string esperado."
        },

        "enunciado": { "type": "string", "description": "[verdadero_falso] La afirmación a evaluar." },

        "frase": { "type": "string", "description": "[llenar_frase] Frase con un solo hueco marcado como '___'." },

        "instruccion": { "type": "string", "description": "[relacionar_columnas] Instrucción para el alumno." },
        "columnaA": { "type": "array", "items": { "type": "string" }, "description": "[relacionar_columnas] Elementos a relacionar." },
        "columnaB": { "type": "array", "items": { "type": "string" }, "description": "[relacionar_columnas] Opciones de pareja (se muestran en un <select> por fila)." },
        "parejasCorrectas": {
          "type": "array",
          "items": { "type": "integer" },
          "description": "[relacionar_columnas] Mismo orden que columnaA; cada valor es el índice en columnaB de su pareja correcta."
        },

        "operacion": {
          "type": "string",
          "enum": ["suma", "resta", "multiplicacion"],
          "description": "[algoritmo_columnas] Qué operación representa el algoritmo vertical dibujado (Paso 18). Determina solo el texto de apoyo mostrado, no la validación — la validación siempre compara dígito por dígito contra 'valor'."
        },
        "filas": {
          "type": "array",
          "minItems": 2,
          "description": "[algoritmo_columnas] Las filas del algoritmo vertical, en orden de arriba hacia abajo: primero los operandos (y, en una multiplicación con multiplicador de 2+ cifras, los productos parciales), al final la fila con 'esResultado':true (bajo la línea horizontal). Todas las filas se alinean a la derecha como en un algoritmo escrito en papel.",
          "items": {
            "type": "object",
            "required": ["valor"],
            "properties": {
              "valor": { "type": "string", "pattern": "^[0-9]+(\\.[0-9]+)?$", "description": "El número COMPLETO y correcto de esta fila (con punto decimal si aplica), tal como debe quedar una vez resuelto — de aquí se derivan tanto los dígitos ya dados como los correctos de las casillas vacías." },
              "signo": { "type": "string", "enum": ["+", "-", "×"], "description": "Si se muestra un signo de operación a la izquierda de esta fila (normalmente solo en la última fila de operandos/productos parciales, justo arriba de la línea)." },
              "esResultado": { "type": "boolean", "description": "true en la fila del resultado final (se dibuja una línea horizontal arriba de ella)." }
            }
          }
        },
        "ocultos": {
          "type": "array",
          "description": "[algoritmo_columnas] Mismo largo y mismo orden que 'filas': para cada fila, la lista de posiciones (índice de carácter dentro de 'valor', 0 = el dígito más a la izquierda; si 'valor' tiene punto decimal, el punto también cuenta como una posición del string pero nunca debe marcarse como oculto) que se muestran como casilla vacía para que el alumno la complete. Las posiciones que NO aparecen aquí se muestran como dígito ya escrito (dado)."
        }
      }
    }
  }
}
